Category,Title,Link
Arts-and-Entertainment,Take the Perfect Thirst Trap,https://www.wikihow.com/Thirst-Trap-Poses
Arts-and-Entertainment,Get Hunter Eyes Naturally or with Surgery,https://www.wikihow.com/Get-Hunter-Eyes
Arts-and-Entertainment,Create a Macrame or Sliding Knot Adjustable Bracelet,https://www.wikihow.com/Make-Adjustable-Bracelets
Arts-and-Entertainment,Dress Up for a Disco Party,https://www.wikihow.com/Dress-Up-for-a-Disco-Party
Arts-and-Entertainment,Go Clubbing,https://www.wikihow.com/Go-Clubbing
Arts-and-Entertainment,Make Your Own TV Show,https://www.wikihow.com/Make-Your-Own-TV-Show
Arts-and-Entertainment,"Get Cast on ""Love Is Blind"" and Find Your Other Half",https://www.wikihow.com/Get-on-Love-Is-Blind
Arts-and-Entertainment,Dance Disco,https://www.wikihow.com/Dance-Disco
Arts-and-Entertainment,Build a Float,https://www.wikihow.com/Build-a-Float
Arts-and-Entertainment,Tell a Story,https://www.wikihow.com/Tell-a-Story
Arts-and-Entertainment,Reach Bannerghatta National Park from Bangalore,https://www.wikihow.com/Reach-Bannerghatta-National-Park-from-Bangalore
Arts-and-Entertainment,Organize a Parade,https://www.wikihow.com/Organize-a-Parade
Arts-and-Entertainment,Make Illuminated Manuscripts,https://www.wikihow.com/Make-Illuminated-Manuscripts
Arts-and-Entertainment,Be Talented in Multiple Areas,https://www.wikihow.com/Be-Talented-in-Multiple-Areas
Arts-and-Entertainment,Apply Glaze over Chalk Paint,https://www.wikihow.com/Apply-Glaze-over-Chalk-Paint
Arts-and-Entertainment,Become a Professional Storyteller,https://www.wikihow.com/Become-a-Professional-Storyteller
Arts-and-Entertainment,Be Able to Create a Story,https://www.wikihow.com/Be-Able-to-Create-a-Story
Arts-and-Entertainment,Host an Open Mic Night,https://www.wikihow.com/Host-an-Open-Mic-Night
Arts-and-Entertainment,Expert Make My Own Wedding Bouquets,https://www.wikihow.com/Expert-Make-My-Own-Wedding-Bouquets
Arts-and-Entertainment,Expert Choose Wedding Shoes,https://www.wikihow.com/Expert-Choose-Wedding-Shoes
Arts-and-Entertainment,Expert How Do You Stay On Budget When Planning a Wedding,https://www.wikihow.com/Expert-How-Do-You-Stay-On-Budget-When-Planning-a-Wedding
Arts-and-Entertainment,Expert Create Unique Wedding Invitations,https://www.wikihow.com/Expert-Create-Unique-Wedding-Invitations
Arts-and-Entertainment,Expert Make A Wedding Budget,https://www.wikihow.com/Expert-Make-A-Wedding-Budget
Arts-and-Entertainment,Expert Decorate A Car For My Drive Away,https://www.wikihow.com/Expert-Decorate-A-Car-For-My-Drive-Away
Arts-and-Entertainment,Expert Common Myths About Wedding Planning,https://www.wikihow.com/Expert-Common-Myths-About-Wedding-Planning
Arts-and-Entertainment,Expert Decorate My Sweetheart Table,https://www.wikihow.com/Expert-Decorate-My-Sweetheart-Table
Arts-and-Entertainment,Expert Choose A Wedding Florist,https://www.wikihow.com/Expert-Choose-A-Wedding-Florist
Arts-and-Entertainment,Read Ulysses,https://www.wikihow.com/Read-Ulysses
Arts-and-Entertainment,Clap Your Hands,https://www.wikihow.com/Clap-Your-Hands
Arts-and-Entertainment,Read a Long Chapter Book in Two or Three Hours,https://www.wikihow.com/Read-a-Long-Chapter-Book-in-Two-or-Three-Hours
Arts-and-Entertainment,Convert .GPX to GP5 (with Tuxguitar),https://www.wikihow.com/Convert-.GPX-to-GP5-(with-Tuxguitar)
Arts-and-Entertainment,Make a Professional Rap Music Video,https://www.wikihow.com/Make-a-Professional-Rap-Music-Video
Arts-and-Entertainment,Direct a Choir,https://www.wikihow.com/Direct-a-Choir
Arts-and-Entertainment,Find Waldo,https://www.wikihow.com/Find-Waldo
Arts-and-Entertainment,Make a Recording Studio,https://www.wikihow.com/Make-a-Recording-Studio
Arts-and-Entertainment,Make a Cover Page,https://www.wikihow.com/Make-a-Cover-Page
Arts-and-Entertainment,Become a Better Artist,https://www.wikihow.com/Become-a-Better-Artist
Arts-and-Entertainment,Have Presence,https://www.wikihow.com/Have-Presence
Arts-and-Entertainment,Make a CD Mix,https://www.wikihow.com/Make-a-CD-Mix
Arts-and-Entertainment,Ask Your Parents to Let You Go to a Concert,https://www.wikihow.com/Ask-Your-Parents-to-Let-You-Go-to-a-Concert
Arts-and-Entertainment,Find Inspiration to Write Songs,https://www.wikihow.com/Find-Inspiration-to-Write-Songs
Arts-and-Entertainment,Write an Art Exhibition Review,https://www.wikihow.com/Write-an-Art-Exhibition-Review
Arts-and-Entertainment,Deconstruct a Text,https://www.wikihow.com/Deconstruct-a-Text
Arts-and-Entertainment,Go to a Concert if You Are a Teenager,https://www.wikihow.com/Go-to-a-Concert-if-You-Are-a-Teenager
Arts-and-Entertainment,Cut a Picture Mat,https://www.wikihow.com/Cut-a-Picture-Mat
Arts-and-Entertainment,Sell Your Music,https://www.wikihow.com/Sell-Your-Music
Arts-and-Entertainment,"Develop a ""Radio Voice""",https://www.wikihow.com/Develop-a-%22Radio-Voice%22
Arts-and-Entertainment,Get Over the Death of a Fictional Character,https://www.wikihow.com/Get-Over-the-Death-of-a-Fictional-Character
Arts-and-Entertainment,Be a Good Ventriloquist,https://www.wikihow.com/Be-a-Good-Ventriloquist
Arts-and-Entertainment,Calculate the Time Signature of a Song,https://www.wikihow.com/Calculate-the-Time-Signature-of-a-Song
Arts-and-Entertainment,Read at Night,https://www.wikihow.com/Read-at-Night
Arts-and-Entertainment,Pretend to Be a Girl,https://www.wikihow.com/Pretend-to-Be-a-Girl
Arts-and-Entertainment,Choose a Good Book,https://www.wikihow.com/Choose-a-Good-Book
Arts-and-Entertainment,Start Creating Music,https://www.wikihow.com/Start-Creating-Music
Arts-and-Entertainment,Make Fan Art,https://www.wikihow.com/Make-Fan-Art
Arts-and-Entertainment,Look Like You Are on Drugs,https://www.wikihow.com/Look-Like-You-Are-on-Drugs
Arts-and-Entertainment,Play Boogie Woogie Piano,https://www.wikihow.com/Play-Boogie-Woogie-Piano
Arts-and-Entertainment,Read a Novel,https://www.wikihow.com/Read-a-Novel
Arts-and-Entertainment,Make a Mixtape,https://www.wikihow.com/Make-a-Mixtape
Arts-and-Entertainment,Have Fun at a Mall,https://www.wikihow.com/Have-Fun-at-a-Mall
Arts-and-Entertainment,Be Well Read,https://www.wikihow.com/Be-Well-Read
Arts-and-Entertainment,Attend a Concert,https://www.wikihow.com/Attend-a-Concert
Arts-and-Entertainment,Understand Fire Breathing,https://www.wikihow.com/Understand-Fire-Breathing
Arts-and-Entertainment,Make Cosplay Costumes,https://www.wikihow.com/Make-Cosplay-Costumes
Arts-and-Entertainment,Read a Newspaper,https://www.wikihow.com/Read-a-Newspaper
Arts-and-Entertainment,Cosplay,https://www.wikihow.com/Cosplay
Arts-and-Entertainment,Add Music to Your Music Library,https://www.wikihow.com/Add-Music-to-Your-Music-Library
Arts-and-Entertainment,Teach Yourself to Read,https://www.wikihow.com/Teach-Yourself-to-Read
Arts-and-Entertainment,Make All of the Naruto Hand Seals (Plus What They Mean),https://www.wikihow.com/Naruto-Hand-Signs
Artwork,Identify a Painting,https://www.wikihow.com/Identify-a-Painting
Artwork,Write in Calligraphy,https://www.wikihow.com/Write-in-Calligraphy
Artwork,Host a Successful Art Exhibition,https://www.wikihow.com/Set-Up-an-Art-Exhibition
Artwork,Do Digital Art on Your Phone,https://www.wikihow.com/Do-Digital-Art-on-Your-Phone
Artwork,Write in Gothic Calligraphy,https://www.wikihow.com/Write-in-Gothic-Calligraphy
Artwork,Animate in Procreate,https://www.wikihow.com/Animate-on-Procreate
Artwork,Design a Playbill,https://www.wikihow.com/Design-a-Playbill
Artwork,Make a Mannequin,https://www.wikihow.com/Make-a-Mannequin
Artwork,Create a 3D Model Using Design Software,https://www.wikihow.com/Make-a-3D-Model
Artwork,Critique Artwork,https://www.wikihow.com/Critique-Artwork
Artwork,Make Stickers on Procreate: A Step-by-Step Guide,https://www.wikihow.com/Use-Procreate-to-Make-Stickers
Artwork,Use a Calligraphy Pen: Modern & Classic Styles,https://www.wikihow.com/Write-With-a-Calligraphy-Pen
Artwork,Cut a Picture Mat,https://www.wikihow.com/Cut-a-Picture-Mat
Artwork,Sign a Painting,https://www.wikihow.com/Sign-a-Painting
Artwork,Write an Artist Statement,https://www.wikihow.com/Write-an-Artist-Statement
Artwork,Make a Screen Print,https://www.wikihow.com/Make-a-Screen-Print
Artwork,Copyright Your Artwork,https://www.wikihow.com/Copyright-Your-Artwork
Artwork,Batik,https://www.wikihow.com/Batik
Artwork,Apply Heat Transfer Vinyl,https://www.wikihow.com/Apply-Heat-Transfer-Vinyl
Artwork,Mat Artwork,https://www.wikihow.com/Mat-Artwork
Artwork,Use a Chinese Calligraphy Brush,https://www.wikihow.com/Use-a-Chinese-Calligraphy-Brush
Artwork,Find Your Own Art Style,https://www.wikihow.com/Find-Your-Own-Art-Style
Artwork,Clean Oil Pastels,https://www.wikihow.com/Clean-Oil-Pastels
Artwork,Be a Self Taught Artist,https://www.wikihow.com/Be-a-Self-Taught-Artist
Artwork,Properly Hold and Use a Brush Pen,https://www.wikihow.com/Use-a-Brush-Pen
Artwork,Name Your Solo Art Exhibition,https://www.wikihow.com/Name-Your-Solo-Art-Exhibition
Artwork,Be Good at Art,https://www.wikihow.com/Be-Good-at-Art
Artwork,Become a Better Artist,https://www.wikihow.com/Become-a-Better-Artist
Artwork,Paint Tulips in Watercolor,https://www.wikihow.com/Paint-Tulips-in-Watercolor
Books,Fix Wavy Book Pages with Water & Heat,https://www.wikihow.com/Fix-Wavy-Book-Pages
Books,Quote a Book,https://www.wikihow.com/Quote-a-Book
Books,Make Activity Books for Children,https://www.wikihow.com/Make-Activity-Books-for-Children
Books,Find the Value of Old Books,https://www.wikihow.com/Find-the-Value-of-Old-Books
Books,Wrap Books As a Gift,https://www.wikihow.com/Wrap-Books-As-a-Gift
Books,Tell the Edition of a Book,https://www.wikihow.com/Tell-the-Edition-of-a-Book
Books,Order a Phone Book,https://www.wikihow.com/Order-a-Phone-Book
Books,Share Kindle Books with Family and Friends,https://www.wikihow.com/Share-Books-on-Kindle
Books,Write a Book Summary: Expert-Backed Tips & Advice,https://www.wikihow.com/Write-a-Book-Summary
Books,DIY a Totally Fetch Burn Book,https://www.wikihow.com/Create-a-Burn-Book
Books,Understand Homestuck Quadrants,https://www.wikihow.com/Understand-Homestuck-Quadrants
Books,Write a Good Summary for a Book Report,https://www.wikihow.com/Write-a-Good-Summary-for-a-Book-Report
Books,Get Free Books by Mail: Everything You Need to Know,https://www.wikihow.com/Free-Books-by-Mail
Books,Sign a Book,https://www.wikihow.com/Sign-a-Book
Books,Choose a Good Book,https://www.wikihow.com/Choose-a-Good-Book
Books,Analyze a Book,https://www.wikihow.com/Analyze-a-Book
Books,Create a Graphic Novel,https://www.wikihow.com/Create-a-Graphic-Novel
Books,Read Homestuck,https://www.wikihow.com/Read-Homestuck
Books,Read Comics,https://www.wikihow.com/Read-Comics
Books,Copy and Paste Google Books,https://www.wikihow.com/Copy-and-Paste-Google-Books
Books,Cite a Book Chapter in APA,https://www.wikihow.com/Cite-a-Book-Chapter-in-APA
Books,Write a Textbook,https://www.wikihow.com/Write-a-Textbook
Books,Search eBooks on Google,https://www.wikihow.com/Search-eBooks-on-Google
Books,Use a Thesaurus,https://www.wikihow.com/Use-a-Thesaurus
Books,Be Well Read,https://www.wikihow.com/Be-Well-Read
Books,Recommend a Book,https://www.wikihow.com/Recommend-a-Book
Books,Distinguish Between a Comic Book and a Graphic Novel,https://www.wikihow.com/Distinguish-Between-a-Comic-Book-and-a-Graphic-Novel
Books,Use an Encyclopedia,https://www.wikihow.com/Use-an-Encyclopedia
Movies,Stop Being Scared After Watching Scary Movies,https://www.wikihow.com/Stop-Being-Scared-After-Watching-Scary-Movies
Movies,Make It in Hollywood,https://www.wikihow.com/Make-It-in-Hollywood
Movies,Watch a Horror Movie,https://www.wikihow.com/Watch-a-Horror-Movie
Movies,Become a Bollywood Actress,https://www.wikihow.com/Become-a-Bollywood-Actress
Movies,Find the Name of a Movie You Can't Remember,https://www.wikihow.com/Find-a-Movie-That-I-Can%27t-Remember
Movies,Safely and Securely Download Movies Using uTorrent,https://www.wikihow.com/Download-Movies-Using-uTorrent
Movies,Attach Subtitles to a Movie,https://www.wikihow.com/Add-Subtitles-to-a-Movie
Movies,Watch Movies in Theaters At Home,https://www.wikihow.com/Watch-Movies-in-Theaters-at-Home
Movies,Attend Movie Premieres,https://www.wikihow.com/Attend-Movie-Premieres
Movies,Make a Funny Video,https://www.wikihow.com/Make-a-Funny-Video
Movies,Submit a New Movie Title to IMDb,https://www.wikihow.com/Add-a-Film-to-IMDb
Movies,Rent Movies from Redbox,https://www.wikihow.com/Rent-Movies-from-Redbox
Movies,Watch a Movie With a PS2 Console,https://www.wikihow.com/Watch-a-Movie-With-a-PS2-Console
Movies,Get Into Bollywood,https://www.wikihow.com/Get-Into-Bollywood
Movies,Use a VHS Tape,https://www.wikihow.com/Use-a-Vhs-Tape
Movies,Watch Movies and TV Online for Free,https://www.wikihow.com/Watch-Movies-and-TV-Online-for-Free
Movies,Rate Movies on Amazon Prime,https://www.wikihow.com/Rate-Movies-on-Amazon-Prime
Movies,Watch a Movie at Home with Your Girlfriend (Teens),https://www.wikihow.com/Watch-a-Movie-at-Home-with-Your-Girlfriend-(Teens)
Movies,Choose a Good Movie to Watch,https://www.wikihow.com/Choose-a-Good-Movie-to-Watch
Movies,Watch Movies for Free,https://www.wikihow.com/Watch-Movies-for-Free
Movies,Work in Hollywood: Tips for Landing Your Dream Job,https://www.wikihow.com/Get-a-Job-in-Hollywood
Movies,Plan a Movie Marathon,https://www.wikihow.com/Plan-a-Movie-Marathon
Movies,Understand Movie Ratings,https://www.wikihow.com/Understand-Movie-Ratings
Movies,Have a Movie Night With Friends,https://www.wikihow.com/Have-a-Movie-Night-With-Friends
Movies,Use the IMDb App,https://www.wikihow.com/Use-the-IMDb-App
Movies,Export Your IMDb Custom Lists to a CSV File,https://www.wikihow.com/Export-Your-IMDb-Custom-Lists-to-a-CSV-File
Movies,Watch and Enjoy a Film at Home,https://www.wikihow.com/Enjoy-a-Movie-at-Home
Movies,Be a Cinephile,https://www.wikihow.com/Be-a-Cinephile
Movies,Watch a Movie,https://www.wikihow.com/Watch-a-Movie
Movies,Stop 'Jumping' During a Horror Movie,https://www.wikihow.com/Stop-%27Jumping%27-During-a-Horror-Movie
Movies,Get a Scary Movie Off Your Mind,https://www.wikihow.com/Get-a-Scary-Movie-Off-Your-Mind
Movies,Become a Film Buff,https://www.wikihow.com/Become-a-Film-Buff
Movies,Get Over a Scary Movie You Saw,https://www.wikihow.com/Get-Over-a-Scary-Movie-You-Saw
Computers-and-Electronics,Use the Split Screen Feature on a Dell: Beginner’s Tutorial,https://www.wikihow.com/Split-Screen-on-Dell
Computers-and-Electronics,Use a Digital Multimeter,https://www.wikihow.com/Use-a-Digital-Multimeter
Computers-and-Electronics,Mute Yourself During a Zoom Call,https://www.wikihow.com/Mute-or-Unmute-on-Zoom
Computers-and-Electronics,Use a Vending Machine: Cash or Credit Card,https://www.wikihow.com/Use-a-Vending-Machine
Computers-and-Electronics,Mount an ISO Image,https://www.wikihow.com/Mount-an-ISO-Image
Computers-and-Electronics,Buy Bitcoins: Easy & Trustworthy Options + Tips,https://www.wikihow.com/Buy-Bitcoins
Computers-and-Electronics,"Turn Off Low Power Mode on Your Apple, Android, or Windows Device",https://www.wikihow.com/Turn-Off-Low-Power-Mode
Computers-and-Electronics,Use ChatGPT & OpenAI Without a Phone Number,https://www.wikihow.com/Chatgpt-Without-Phone-Number
Computers-and-Electronics,Clean a Laptop,https://www.wikihow.com/Clean-a-Laptop
Computers-and-Electronics,Play a Video in a Zoom Meeting,https://www.wikihow.com/Play-a-Video-in-a-Zoom-Meeting
Computers-and-Electronics,Spot Misinformation Online,https://www.wikihow.com/Spot-Misinformation-Online
Computers-and-Electronics,Check Browsing History on a WiFi Router,https://www.wikihow.com/Check-Browsing-History-on-a-WiFi-Router
Computers-and-Electronics,Remove Write Protection from a USB Pen Drive,https://www.wikihow.com/Remove-Write-Protection-from-a-USB-Drive
Computers-and-Electronics,Connect PC to TV with HDMI,https://www.wikihow.com/Connect-PC-to-TV-with-HDMI
Computers-and-Electronics,Add the Google Play Store to an Amazon Fire Tablet,https://www.wikihow.com/Install-the-Google-Play-Store-on-an-Amazon-Fire
Computers-and-Electronics,"Bypass Your Screen Time Passcode: Reset, Remove, or Hack Screen Time",https://www.wikihow.com/Bypass-Screen-Time-Passcode
Computers-and-Electronics,Turn on Backlit Keyboard on Lenovo,https://www.wikihow.com/Turn-on-Keyboard-Light-Lenovo
Computers-and-Electronics,Format a Write–Protected Pen Drive,https://www.wikihow.com/Format-a-Write%E2%80%93Protected-Pen-Drive
Computers-and-Electronics,Create Desktop Shortcuts for Files & Websites,https://www.wikihow.com/Create-a-Desktop-Shortcut
Computers-and-Electronics,Guess a Password,https://www.wikihow.com/Guess-a-Password
Computers-and-Electronics,Restart Your Computer Using the Keyboard,https://www.wikihow.com/Restart-Your-Computer-Using-the-Keyboard
Computers-and-Electronics,Tell if Your Mac Is Too Old to Update,https://www.wikihow.com/Tell-if-Your-Mac-Is-Too-Old-to-Update
Computers-and-Electronics,Do a Digital Detox,https://www.wikihow.com/Do-a-Digital-Detox
Computers-and-Electronics,Listen to Police Radio Online: Best Apps & Websites,https://www.wikihow.com/Listen-to-Police-Radio
Computers-and-Electronics,"Disable Screen Mirroring: iPhone, Mac, Android, & More",https://www.wikihow.com/Turn-Off-Screen-Mirroring
Computers-and-Electronics,Open a Digital Safe Without a Key,https://www.wikihow.com/Open-a-Digital-Safe-Without-a-Key
Computers-and-Electronics,Save Videos on Telegram on PC or Mac,https://www.wikihow.com/Save-Videos-on-Telegram-on-PC-or-Mac
Computers-and-Electronics,Search Google,https://www.wikihow.com/Search-Google
Computers-and-Electronics,Transfer Files Between Computers on the Same Network,https://www.wikihow.com/Transfer-Files-Between-Computers-on-the-Same-Network
Computers-and-Electronics,Connect a Laptop to a Projector,https://www.wikihow.com/Connect-a-Laptop-to-a-Projector
Computers-and-Electronics,Turn on a Samsung TV Without a Remote,https://www.wikihow.com/Turn-on-Samsung-TV-Without-Remote
Computers-and-Electronics,Rip Music from a CD to a USB Drive: Windows & Mac,https://www.wikihow.com/Copy-Music-from-CD-to-USB
Computers-and-Electronics,Connect a MacBook to an iMac: 2 Step-by-Step Methods,https://www.wikihow.com/Connect-a-Macbook-to-an-iMac
Computers-and-Electronics,Quickly Convert HEIC Photos to JPG on Your iPhone or Mac,https://www.wikihow.com/Convert-iPhone-Photos-to-JPG
Computers-and-Electronics,Install Epson SmartScan Software: Step-By-Step Guide,https://www.wikihow.com/Download-Epson-Scan-Software
Computers-and-Electronics,Copy Drivers from One Computer to Another on PC or Mac,https://www.wikihow.com/Copy-Drivers-from-One-Computer-to-Another-on-PC-or-Mac
Computers-and-Electronics,Find Your Subnet Mask: The Complete Guide,https://www.wikihow.com/Find-Your-Subnet-Mask
Computers-and-Electronics,Send Messages on WhatsApp,https://www.wikihow.com/Send-Messages-on-WhatsApp
Computers-and-Electronics,Drag-Click on a Mouse,https://www.wikihow.com/Drag-Click
Computers-and-Electronics,Get 4G LTE,https://www.wikihow.com/Get-4G-LTE
Computers-and-Electronics,Run Files in Linux,https://www.wikihow.com/Run-Files-in-Linux
Computers-and-Electronics,Repair Corrupted BIOS Firmware,https://www.wikihow.com/Repair-Corrupted-BIOS-Firmware
Computers-and-Electronics,Move a Camera in Blender 3D,https://www.wikihow.com/Move-Camera-in-Blender
Computers-and-Electronics,Open XPS Files,https://www.wikihow.com/Open-XPS-Files
Computers-and-Electronics,Download Free Apps and Games on the App Store: Step-by-Step Guide,https://www.wikihow.com/Download-Free-Apps-on-App-Store
Computers-and-Electronics,Connect PC Internet to Mobile via WiFi,https://www.wikihow.com/Connect-PC-Internet-to-Mobile-via-WiFi
Computers-and-Electronics,"Fix ""Update Apple ID Settings"" Stuck on iPhone, iPad, & Mac",https://www.wikihow.com/Update-Apple-ID-Settings-Stuck
Computers-and-Electronics,Turn off a PS4 Without a Controller,https://www.wikihow.com/Turn-Off-PS4-Without-Controller
Computers-and-Electronics,Save a Dying Conversation over Text,https://www.wikihow.com/Save-a-Dying-Conversation-over-Text
Computers-and-Electronics,Set the Default Audio Track in VLC,https://www.wikihow.com/Set-the-Default-Audio-Track-in-VLC
Computers-and-Electronics,Enable a Port on a Cisco Switch,https://www.wikihow.com/Enable-a-Port-on-a-Cisco-Switch
Computers-and-Electronics,Ctrl Alt Delete on a Mac: Quit Apps + Check Performance,https://www.wikihow.com/Ctrl-Alt-Delete-Mac
Computers-and-Electronics,Report a Faulty Phone Line,https://www.wikihow.com/Report-a-Faulty-Phone-Line
Computers-and-Electronics,Fix a Hacked Android Phone,https://www.wikihow.com/Fix-a-Hacked-Android-Phone
Computers-and-Electronics,Stream Nintendo Switch to Discord,https://www.wikihow.com/Stream-Nintendo-Switch-to-Discord
Computers-and-Electronics,Install Arch Linux Dual Boot on Any Computer,https://www.wikihow.com/Install-Arch-Linux-Dual-Boot
Computers-and-Electronics,Log Out of Google Play on Android & Desktop,https://www.wikihow.com/Log-Off-Google-Play
Computers-and-Electronics,Freeze and Unfreeze Panes in Excel,https://www.wikihow.com/Freeze-and-Unfreeze-Panes-in-Excel
Computers-and-Electronics,Charge a Battery Without a Charger,https://www.wikihow.com/Charge-a-Battery-Without-a-Charger
Computers-and-Electronics,Search the Internet & Find Exactly What You Want,https://www.wikihow.com/Search-the-Internet
Computers-and-Electronics,Close a Dialog Box,https://www.wikihow.com/Close-a-Dialog-Box
Computers-and-Electronics,Create a Microsoft Account,https://www.wikihow.com/Create-a-Microsoft-Account
Computers-and-Electronics,Charge a Kindle Paperwhite,https://www.wikihow.com/Charge-a-Kindle-Paperwhite
Computers-and-Electronics,"Use AirPlay with an iPhone, iPad, Mac, or Apple TV",https://www.wikihow.com/Turn-On-AirPlay
Computers-and-Electronics,"Find the Service Tag of Your Dell Device: PC, Tablet, or Accessory",https://www.wikihow.com/Determine-Your-Dell-Service-Tag
Computers-and-Electronics,Connect to MiFi,https://www.wikihow.com/Connect-to-MiFi
Computers-and-Electronics,Fix Oculus Controllers That Are Not Responding,https://www.wikihow.com/Oculus-Controller-Not-Working
Computers-and-Electronics,Protect Electronics from an Electromagnetic Pulse,https://www.wikihow.com/Protect-Electronics-from-an-Electromagnetic-Pulse
Computers-and-Electronics,Turn On In-App Purchases in the iOS App Store,https://www.wikihow.com/Enable-in-App-Purchases
Computers-and-Electronics,Clear a Flash Drive on PC or Mac,https://www.wikihow.com/Clear-a-Flash-Drive-on-PC-or-Mac
Computers-and-Electronics,Delete Duplicates in Word,https://www.wikihow.com/Delete-Duplicates-in-Word
Computers-and-Electronics,Factory Reset a Oculus Quest 2 Headset,https://www.wikihow.com/Factory-Reset-Oculus-Quest-2
Computers-and-Electronics,Open Mobi Files on iPhone or iPad,https://www.wikihow.com/Open-Mobi-Files-on-iPhone-or-iPad
Computers-and-Electronics,Hack a Computer,https://www.wikihow.com/Hack-a-Computer
Computers-and-Electronics,Why Your QR Code is Blurry and  Fix It,https://www.wikihow.com/Qr-Code-Blurry
Computers-and-Electronics,Reset a JBL Speaker That Keeps Disconnecting Randomly,https://www.wikihow.com/Reset-Jbl-Speaker
Computers-and-Electronics,Update the Garmin Nuvi Using Garmin Express and More,https://www.wikihow.com/Update-the-Garmin-Nuvi
Computers-and-Electronics,Clear the Record of USB Plug in Equipment,https://www.wikihow.com/Clear-the-Record-of-USB-Plug-in-Equipment
Computers-and-Electronics,Fix the Issue of a TV Turning Off Repeatedly,https://www.wikihow.com/Why-Does-My-TV-Keep-Turning-Off
Computers-and-Electronics,Solve a “Device Descriptor Request Failed” Computer Error,https://www.wikihow.com/Device-Descriptor-Request-Failed
Computers,View System Information on Windows & Mac in Seconds,https://www.wikihow.com/Check-Your-Computer%27s-System-Information
Computers,Make It Look Like You are Hacking,https://www.wikihow.com/Make-It-Look-Like-You-Are-Hacking
Computers,"Have Computer Fun: Content, Games, Writing, & More",https://www.wikihow.com/Have-Computer-Fun
Computers,"See All Open Apps and Windows (for Windows 10, 11, and Mac)",https://www.wikihow.com/See-All-Open-Windows
Computers,Enable XMP: Step-by-Step Guide for Easy Overclocking,https://www.wikihow.com/Enable-Xmp
Computers,Find out How Long Your Computer Has Been On,https://www.wikihow.com/Find-out-How-Long-Your-Computer-Has-Been-On
Computers,"Print Screen on an HP Laptop, Desktop, or Tablet",https://www.wikihow.com/Print-Screen-on-HP
Computers,Remove a Computer from Accessing Steam,https://www.wikihow.com/Remove-a-Computer-from-Accessing-Steam
Computers,Run Scandisk on Windows 10,https://www.wikihow.com/Run-Scandisk-on-Windows-10
Computers,Install a BIOS Update from a USB,https://www.wikihow.com/Install-a-Bios-Update-from-a-USB
Computers,Check if Your Computer Is 64 Bit,https://www.wikihow.com/Check-if-Your-Computer-Is-64-Bit
Computers,Destroy an Old Computer,https://www.wikihow.com/Destroy-an-Old-Computer
Computers,Report Hackers,https://www.wikihow.com/Report-Hackers
Computers,Copy Multiple Links at Once,https://www.wikihow.com/Copy-Multiple-Links-at-Once
Computers,Be a Computer Genius,https://www.wikihow.com/Be-a-Computer-Genius
Computers,Turn Off Firewall,https://www.wikihow.com/Turn-Off-Firewall
Computers,Remove a Device from the HP Smart App,https://www.wikihow.com/Remove-a-Device-from-HP-Smart-App-on-a-PC
Computers,Know if You've Been Hacked,https://www.wikihow.com/Know-if-You%27ve-Been-Hacked
Computers,Use MEGA Cloud Storage,https://www.wikihow.com/Use-MEGA-Cloud-Storage
Computers,Add a Computer to a Domain on PC: Step-by-Step Guide,https://www.wikihow.com/Add-a-Computer-to-a-Domain-on-PC
Computers,Keep Your Google Account Safe from Hackers,https://www.wikihow.com/Keep-Your-Google-Account-Safe-from-Hackers
Computers,See Frame Rates,https://www.wikihow.com/See-Frame-Rates
Computers,Operate Multiple Computers With One Keyboard and Monitor,https://www.wikihow.com/Operate-Multiple-Computers-With-One-Keyboard-and-Monitor
Computers,Run Your Desktop off DC Power,https://www.wikihow.com/Run-Your-Desktop-off-DC-Power
