Category,Title,Link
Personal-Care,Have More Self Confidence and Love Yourself,https://www.wikihow.com/Have-More-Self-Confidence-and-Love-Yourself
Personal-Care,Be a Pretty Teenage Girl,https://www.wikihow.com/Be-a-Pretty-Teenage-Girl
Personal-Care,Look Beautiful As a Teenage Girl,https://www.wikihow.com/Look-Beautiful-As-a-Teenage-Girl
Personal-Care,Have Perfect Skin As a Teen,https://www.wikihow.com/Have-Perfect-Skin-As-a-Teen
Personal-Care,Look Clean and Fresh for School,https://www.wikihow.com/Look-Clean-and-Fresh-for-School
Personal-Care,Wash Your Face (Teens),https://www.wikihow.com/Wash-Your-Face-(Teens)
Personal-Care,Make an Emergency Kit for Teenage Girls,https://www.wikihow.com/Make-an-Emergency-Kit-for-Teenage-Girls
Personal-Care,Be Perfect (Kids/Teens),https://www.wikihow.com/Be-Perfect-(Kids/Teens)
Personal-Care,Look Your Best Every Day (for Girls),https://www.wikihow.com/Look-Your-Best-Every-Day-(for-Girls)
Personal-Care,Look Attractive and Natural (Girls),https://www.wikihow.com/Look-Attractive-and-Natural-(Girls)
School-Stuff,Become Valedictorian,https://www.wikihow.com/Become-Valedictorian
School-Stuff,Register & Enroll Your Child in School,https://www.wikihow.com/Register-a-Child-for-School
School-Stuff,Start an Afterschool Program,https://www.wikihow.com/Start-an-Afterschool-Program
School-Stuff,Make Your School More Period Friendly,https://www.wikihow.com/Make-Your-School-More-Period-Friendly
School-Stuff,Keep Your School Clean,https://www.wikihow.com/Keep-Your-School-Clean
School-Stuff,Find Out if School Is Cancelled for Bad Weather,https://www.wikihow.com/Find-Out-if-School-Is-Cancelled-for-Bad-Weather
School-Stuff,Skip a Grade,https://www.wikihow.com/Skip-a-Grade
School-Stuff,Convince Your Parents to Let You Switch Schools,https://www.wikihow.com/Convince-Your-Parents-to-Let-You-Switch-Schools
School-Stuff,Change In a School Locker Room,https://www.wikihow.com/Change-In-a-School-Locker-Room
School-Stuff,Make Your School a Better Place,https://www.wikihow.com/Make-Your-School-a-Better-Place
School-Stuff,Be Happy on School Days,https://www.wikihow.com/Be-Happy-on-School-Days
School-Stuff,Have a Fun Last Day of School,https://www.wikihow.com/Have-a-Fun-Last-Day-of-School
School-Stuff,Change Your Classes in High School,https://www.wikihow.com/Change-Your-Classes-in-High-School
School-Stuff,Plan a High School Reunion,https://www.wikihow.com/Plan-a-High-School-Reunion
School-Stuff,Excuse Yourself from Unfinished Homework,https://www.wikihow.com/Excuse-Yourself-from-Unfinished-Homework
School-Stuff,Sign a Yearbook,https://www.wikihow.com/Sign-a-Yearbook
School-Stuff,Drop a Class,https://www.wikihow.com/Drop-a-Class
School-Stuff,Be Funny in Class,https://www.wikihow.com/Be-Funny-in-Class
School-Stuff,Cope With Repeating a Grade,https://www.wikihow.com/Cope-With-Repeating-a-Grade
School-Stuff,Look Clean and Fresh for School,https://www.wikihow.com/Look-Clean-and-Fresh-for-School
School-Stuff,Transfer High Schools,https://www.wikihow.com/Transfer-High-Schools
School-Stuff,Be a Good Student Without Being Teacher's Pet,https://www.wikihow.com/Be-a-Good-Student-Without-Being-Teacher%27s-Pet
School-Stuff,Enjoy Your Birthday at School,https://www.wikihow.com/Enjoy-Your-Birthday-at-School
School-Stuff,Transfer to a New Elementary School,https://www.wikihow.com/Transfer-to-a-New-Elementary-School
School-Stuff,Protest in School,https://www.wikihow.com/Protest-in-School
School-Stuff,Participate in Class,https://www.wikihow.com/Participate-in-Class
School-Stuff,Make the School Year Go Faster,https://www.wikihow.com/Make-the-School-Year-Go-Faster
School-Stuff,Be Shy at School,https://www.wikihow.com/Be-Shy-at-School
School-Stuff,Behave on a School Bus,https://www.wikihow.com/Behave-on-a-School-Bus
School-Stuff,Celebrate Halloween at School,https://www.wikihow.com/Celebrate-Halloween-at-School
School-Stuff,Relive School Nostalgia,https://www.wikihow.com/Relive-School-Nostalgia
Finance-and-Business,Calculate Average Growth Rate in Excel,https://www.wikihow.com/Calculate-Average-Growth-Rate-in-Excel
Finance-and-Business,Calculate an Annual Percentage Growth Rate,https://www.wikihow.com/Calculate-an-Annual-Percentage-Growth-Rate
Finance-and-Business,Find Equilibrium Quantity,https://www.wikihow.com/Find-Equilibrium-Quantity
Finance-and-Business,Convert a Joint Bank Account into a Single Account,https://www.wikihow.com/Change-a-Joint-Bank-Account-to-a-Single
Finance-and-Business,Know How Much to Tip a Dog Groomer,https://www.wikihow.com/Know-How-Much-to-Tip-a-Dog-Groomer
Finance-and-Business,Account and Negotiate Forward Contracts,https://www.wikihow.com/Account-for-Forward-Contracts
Finance-and-Business,Find the Total Amount Paid in an Interest Rate Equation,https://www.wikihow.com/Find-the-Total-Amount-Paid-in-an-Interest-Rate-Equation
Finance-and-Business,Calculate Predetermined Overhead Rate (With Examples),https://www.wikihow.com/Calculate-Predetermined-Overhead-Rate
Finance-and-Business,Fill Out a Receipt Book for Your Small Business,https://www.wikihow.com/Fill-Out-a-Receipt-Book
Finance-and-Business,Calculate Cumulative Growth,https://www.wikihow.com/Calculate-Cumulative-Growth
Finance-and-Business,Contact Small Business Owners,https://www.wikihow.com/Contact-Small-Business-Owners
Finance-and-Business,Be Smart with Money,https://www.wikihow.com/Be-Smart-with-Money
Finance-and-Business,Use the Rule of 72,https://www.wikihow.com/Use-the-Rule-of-72
Finance-and-Business,Expert How Can I Prepare For Tax Season,https://www.wikihow.com/Expert-How-Can-I-Prepare-For-Tax-Season
Finance-and-Business,Avoid Probate in Canada,https://www.wikihow.com/Avoid-Probate-in-Canada
Finance-and-Business,Prepare for Economic Collapse,https://www.wikihow.com/Prepare-for-Economic-Collapse
Finance-and-Business,Create an Investment Plan,https://www.wikihow.com/Create-an-Investment-Plan
Finance-and-Business,Start a New Life with No Money,https://www.wikihow.com/Start-a-New-Life-with-No-Money
Finance-and-Business,Successfully Own and Run a Business,https://www.wikihow.com/Be-a-Successful-Business-Owner
Finance-and-Business,Get Money Quickly Without Borrowing It,https://www.wikihow.com/Get-Money-Quickly-Without-Borrowing-It
Finance-and-Business,Conduct a Time and Motion Study,https://www.wikihow.com/Conduct-a-Time-and-Motion-Study
Finance-and-Business,Keep Track of Your Money: Personal Finance Tips,https://www.wikihow.com/Keep-Track-of-Your-Personal-Finances
Finance-and-Business,Dress for a Banking Job,https://www.wikihow.com/Dress-for-a-Banking-Job
Finance-and-Business,Start Investing,https://www.wikihow.com/Start-Investing
Finance-and-Business,Where Is My Wallet?  Protect Your Money & Find a Misplaced Wallet,https://www.wikihow.com/Deal-With-Losing-Your-Wallet
Finance-and-Business,Apply For and Obtain a CKYC Number,https://www.wikihow.com/Get-a-CKYC-Number
Finance-and-Business,Calculate Accident Incident Rate,https://www.wikihow.com/Calculate-Accident-Incident-Rate
Finance-and-Business,Start an Investment Club,https://www.wikihow.com/Start-an-Investment-Club
Finance-and-Business,Stop Being Broke,https://www.wikihow.com/Stop-Being-Broke
Finance-and-Business,Calculate Bond Accrued Interest,https://www.wikihow.com/Calculate-Bond-Accrued-Interest
Finance-and-Business,Ask Rich People for Money,https://www.wikihow.com/Ask-Rich-People-for-Money
Finance-and-Business,Develop a Risk Management Plan,https://www.wikihow.com/Develop-a-Risk-Management-Plan
Finance-and-Business,Start a Charity,https://www.wikihow.com/Start-a-Charity
Finance-and-Business,Overcome Poverty,https://www.wikihow.com/Overcome-Poverty
Finance-and-Business,Calculate and Compare Unit Prices at the Store,https://www.wikihow.com/Calculate-and-Compare-Unit-Prices-at-the-Store
Finance-and-Business,Calculate Annuity Payments,https://www.wikihow.com/Calculate-Annuity-Payments
Finance-and-Business,Report a Bank of America Phishing Email,https://www.wikihow.com/Report-a-Bank-of-America-Phishing-Email
Finance-and-Business,Make ID Cards Online,https://www.wikihow.com/Make-ID-Cards-Online
Finance-and-Business,Submit Damaged Money for Reimbursement,https://www.wikihow.com/Get-Damaged-Currency-Replaced
Finance-and-Business,Cancel Your Costco Membership,https://www.wikihow.com/Cancel-Your-Costco-Membership
Finance-and-Business,Countersue,https://www.wikihow.com/Counter-Sue
Finance-and-Business,Find the Maturity Value for an Investment,https://www.wikihow.com/Calculate-Maturity-Value
Finance-and-Business,Subdivide Property,https://www.wikihow.com/Subdivide-Property
Finance-and-Business,Become a Secret Shopper,https://www.wikihow.com/Become-a-Secret-Shopper
Finance-and-Business,Prepare a Bank Reconciliation,https://www.wikihow.com/Prepare-a-Bank-Reconciliation
Finance-and-Business,Be a Successful Business Woman,https://www.wikihow.com/Be-a-Successful-Business-Woman
Finance-and-Business,Calculate Bank Interest on Savings,https://www.wikihow.com/Calculate-Bank-Interest-on-Savings
Finance-and-Business,Become a Bank Manager,https://www.wikihow.com/Become-a-Bank-Manager
Finance-and-Business,Bid on Government Contracts,https://www.wikihow.com/Bid-on-Government-Contracts
Finance-and-Business,Calculate Cost Increase Percentage,https://www.wikihow.com/Calculate-Cost-Increase-Percentage
Finance-and-Business,Write an Email Asking for Donations,https://www.wikihow.com/Write-an-Email-Asking-for-Donations
Finance-and-Business,Calculate Intrinsic Value,https://www.wikihow.com/Calculate-Intrinsic-Value
Finance-and-Business,Calculate NPV,https://www.wikihow.com/Calculate-NPV
Finance-and-Business,Write a Briefing Paper,https://www.wikihow.com/Write-a-Briefing-Paper
Finance-and-Business,Rezone Property,https://www.wikihow.com/Rezone-Property
Finance-and-Business,Calculate Dividends,https://www.wikihow.com/Calculate-Dividends
Finance-and-Business,Get a Bank Job,https://www.wikihow.com/Get-a-Bank-Job
Finance-and-Business,Run a Silent Auction,https://www.wikihow.com/Run-a-Silent-Auction
Finance-and-Business,Create an Educational Scholarship Fund,https://www.wikihow.com/Create-an-Educational-Scholarship-Fund
Finance-and-Business,Calculate Yield to Maturity,https://www.wikihow.com/Calculate-Yield-to-Maturity
Finance-and-Business,Calculate Your Personal Zakat,https://www.wikihow.com/Calculate-Your-Personal-Zakat
Finance-and-Business,File a Complaint Against a Real Estate Agent,https://www.wikihow.com/File-a-Complaint-Against-a-Real-Estate-Agent
Finance-and-Business,Seek Sponsorships,https://www.wikihow.com/Seek-Sponsorships
Finance-and-Business,Find Your Bank Account Number,https://www.wikihow.com/Find-Your-Bank-Account-Number
Finance-and-Business,Understand Binary Options,https://www.wikihow.com/Understand-Binary-Options
Finance-and-Business,Find a Registry on Amazon: A Step-by-Step Guide,https://www.wikihow.com/How-Do-You-Find-a-Registry-on-Amazon
Finance-and-Business,Here’s What Your 1943 Steel Penny Could Be Worth (And  Value It),https://www.wikihow.com/1943-Steel-Penny-Value
Finance-and-Business,Remove Order History from Amazon & Keep Purchases Private,https://www.wikihow.com/How-Can-I-Delete-Order-History-on-Amazon
Finance-and-Business,Why Your ID Photos Look Bad &  Take Better Pictures,https://www.wikihow.com/Why-Do-I-Look-So-Horrible-in-ID-Pictures
Home-and-Garden,Propagate Elephant Ear Plants,https://www.wikihow.com/Propagate-Elephant-Ear-Plants
Home-and-Garden,Water Air Plants,https://www.wikihow.com/Water-Air-Plants
Home-and-Garden,Design a Small Garden,https://www.wikihow.com/Design-a-Small-Garden
Home-and-Garden,Research the History of Your House,https://www.wikihow.com/Research-the-History-of-Your-House
Home-and-Garden,Replant a Rose,https://www.wikihow.com/Replant-a-Rose
Home-and-Garden,Trim a Monstera Deliciosa,https://www.wikihow.com/Trim-a-Monstera-Deliciosa
Home-and-Garden,Propagate Bamboo,https://www.wikihow.com/Propagate-Bamboo
Home-and-Garden,Dry and Cure Cannabis,https://www.wikihow.com/Dry-and-Cure-Cannabis
Home-and-Garden,Prevent Outdoor Locks from Freezing,https://www.wikihow.com/Prevent-Outdoor-Locks-from-Freezing
Home-and-Garden,Do a Knockdown Texture,https://www.wikihow.com/Do-a-Knockdown-Texture
Home-and-Garden,Determine if You Have Hard Water,https://www.wikihow.com/Determine-if-You-Have-Hard-Water
Home-and-Garden,Attach Garden Hose Fittings,https://www.wikihow.com/Attach-Garden-Hose-Fittings
Home-and-Garden,Build an Elevated Deck: Design to Completion,https://www.wikihow.com/Build-an-Elevated-Deck
Home-and-Garden,Freeze Collard Greens,https://www.wikihow.com/Freeze-Collard-Greens
Home-and-Garden,Air Layer a Tree,https://www.wikihow.com/Air-Layer-a-Tree
Home-and-Garden,Arrange the Inside of a Greenhouse,https://www.wikihow.com/Arrange-the-Inside-of-a-Greenhouse
Home-and-Garden,Cap Off a Sprinkler Head,https://www.wikihow.com/Cap-Off-a-Sprinkler-Head
Home-and-Garden,Hang Corbels,https://www.wikihow.com/Hang-Corbels
Home-and-Garden,Install Wire Fencing for Dogs,https://www.wikihow.com/Install-Wire-Fencing-for-Dogs
Home-and-Garden,Safely Move Your Grandfather Clock: Disassembly and Shipping,https://www.wikihow.com/Move-a-Grandfather-Clock
Home-and-Garden,Cut Molding,https://www.wikihow.com/Cut-Molding
Home-and-Garden,Repair Rattan Garden Furniture,https://www.wikihow.com/Repair-Rattan-Garden-Furniture
Home-and-Garden,Mix Diazinon,https://www.wikihow.com/Mix-Diazinon
Home-and-Garden,Treat Curly Top Virus in Tomatoes,https://www.wikihow.com/Treat-Curly-Top-Virus-in-Tomatoes
Home-and-Garden,Kill Dandelions Naturally,https://www.wikihow.com/Kill-Dandelions-Naturally
Home-and-Garden,Expert Most Common Beginner Gardening Mistake,https://www.wikihow.com/Expert-Most-Common-Beginner-Gardening-Mistake
Home-and-Garden,Expert What Are Patterns For Laying Stone Walkways,https://www.wikihow.com/Expert-What-Are-Patterns-For-Laying-Stone-Walkways
Home-and-Garden,Expert What Does It Mean To Live Zero Waste,https://www.wikihow.com/Expert-What-Does-It-Mean-To-Live-Zero-Waste
Home-and-Garden,Expert Choose Wood to Build a Shed,https://www.wikihow.com/Expert-Choose-Wood-to-Build-a-Shed
Home-and-Garden,Expert What Equipment Do Homeowners Need To Maintain Their Property,https://www.wikihow.com/Expert-What-Equipment-Do-Homeowners-Need-To-Maintain-Their-Property
Home-and-Garden,Expert Easy Plants At Home Edible Garden,https://www.wikihow.com/Expert-Easy-Plants-At-Home-Edible-Garden
Home-and-Garden,Expert Donate Food from Home Garden,https://www.wikihow.com/Expert-Donate-Food-from-Home-Garden
Home-and-Garden,Expert What Types Of Safety Equipment Do I Need To Work With Concrete,https://www.wikihow.com/Expert-What-Types-Of-Safety-Equipment-Do-I-Need-To-Work-With-Concrete
Home-and-Garden,Expert Easy Plants At Home Inedible Garden,https://www.wikihow.com/Expert-Easy-Plants-At-Home-Inedible-Garden
Home-and-Garden,Expert Mix Compost with Soil,https://www.wikihow.com/Expert-Mix-Compost-with-Soil
Home-and-Garden,Make Protective Riot Gear,https://www.wikihow.com/Make-Protective-Riot-Gear
Home-and-Garden,Prune Cilantro,https://www.wikihow.com/Prune-Cilantro
Home-and-Garden,Use a Hammer Safely,https://www.wikihow.com/Use-a-Hammer-Safely
Home-and-Garden,Start a Garden: A Comprehensive Guide,https://www.wikihow.com/Start-a-Garden
Home-and-Garden,Survive a War,https://www.wikihow.com/Survive-a-War
Home-and-Garden,Fix Sinkholes,https://www.wikihow.com/Fix-Sinkholes
Home-and-Garden,Install a Swag Hook,https://www.wikihow.com/Install-a-Swag-Hook
Home-and-Garden,Make Synthetic Gasoline,https://www.wikihow.com/Make-Synthetic-Gasoline
Home-and-Garden,Live without Electricity,https://www.wikihow.com/Live-without-Electricity
Home-and-Garden,Clear a Building with a Firearm,https://www.wikihow.com/Clear-a-Building-with-a-Firearm
Home-and-Garden,Build a Low Cost Home Gym,https://www.wikihow.com/Build-a-Low-Cost-Home-Gym
Home-and-Garden,Prepare for a Drought,https://www.wikihow.com/Prepare-for-a-Drought
Home-and-Garden,Live off the Grid,https://www.wikihow.com/Live-off-the-Grid
Home-and-Garden,Get Free Building Materials,https://www.wikihow.com/Get-Free-Building-Materials
Home-and-Garden,Survive a Riot,https://www.wikihow.com/Survive-a-Riot
Home-and-Garden,Program a Lux Thermostat,https://www.wikihow.com/Program-a-Lux-Thermostat
Home-and-Garden,"Plan, Prepare, and Plant a Garden",https://www.wikihow.com/Garden
Home-and-Garden,Live in the Woods,https://www.wikihow.com/Live-in-the-Woods
Home-and-Garden,Aerate a Yard,https://www.wikihow.com/Aerate-a-Yard
Home-and-Garden,Wire a Light,https://www.wikihow.com/Wire-a-Light
Home-and-Garden,Become a Hobo,https://www.wikihow.com/Become-a-Hobo
Home-and-Garden,Pack Furniture For Moving,https://www.wikihow.com/Pack-Furniture-For-Moving
Home-and-Garden,Save the Environment at Home,https://www.wikihow.com/Save-the-Environment-at-Home
Home-and-Garden,Dig a Bunker,https://www.wikihow.com/Dig-a-Bunker
Home-and-Garden,Build a Fallout Shelter,https://www.wikihow.com/Build-a-Fallout-Shelter
Home-and-Garden,Grow Your Own Food,https://www.wikihow.com/Grow-Your-Own-Food
Home-and-Garden,Settle Into Your First Apartment,https://www.wikihow.com/Settle-Into-Your-First-Apartment
Home-and-Garden,Install a New Light Fixture,https://www.wikihow.com/Install-a-Light-Fixture
Home-and-Garden,Make a Pot in a Pot Refrigerator,https://www.wikihow.com/Make-a-Pot-in-a-Pot-Refrigerator
Home-and-Garden,Determine How Much Water Plants Need,https://www.wikihow.com/Determine-How-Much-Water-Plants-Need
Home-and-Garden,Dumpster Dive,https://www.wikihow.com/Dumpster-Dive
Home-and-Garden,Survive Under Martial Law,https://www.wikihow.com/Survive-Under-Martial-Law
Home-and-Garden,Prepare Used Cooking Oil for Biodiesel,https://www.wikihow.com/Prepare-Used-Cooking-Oil-for-Biodiesel
Home-and-Garden,Be Safe When Home Alone (Kids),https://www.wikihow.com/Be-Safe-When-Home-Alone-(Kids)
Home-and-Garden,Build a Generator,https://www.wikihow.com/Build-a-Generator
Home-and-Garden,Be Safe During a Landslide,https://www.wikihow.com/Be-Safe-During-a-Landslide
Home-and-Garden,Rehab a Property in the Proper Order,https://www.wikihow.com/Rehab-a-Property-in-the-Proper-Order
Home-and-Garden,Close in an Unwanted In Ground Pool,https://www.wikihow.com/Close-in-an-Unwanted-In-Ground-Pool
Home-and-Garden,Use a Generator to Power Your Home Safely,https://www.wikihow.com/Use-a-Generator
Home-and-Garden,Move,https://www.wikihow.com/Move
Home-and-Garden,Build a Concrete Pool,https://www.wikihow.com/Build-a-Concrete-Pool
Home-and-Garden,Build a Safe Room,https://www.wikihow.com/Build-a-Safe-Room
Home-and-Garden,Desalinate Water,https://www.wikihow.com/Desalinate-Water
Home-and-Garden,Build a Pulley,https://www.wikihow.com/Build-a-Pulley
Home-and-Garden,Sink Stopper Stuck? Here’s  Fix It (And Prevent It From Happening),https://www.wikihow.com/Sink-Stopper-Stuck
Home-and-Garden,7 Reasons Your Toilet Tank Isn’t Filling with Water (&  Fix It),https://www.wikihow.com/Toilet-Tank-Not-Filling-with-Water-After-Flush
Home-and-Garden,Fix a Bosch Dishwasher That Isn't Draining,https://www.wikihow.com/Bosch-Dishwasher-Not-Draining
Home-and-Garden,7 Common Reasons Your LG Washer Won’t Drain—and  Fix It,https://www.wikihow.com/Lg-Washer-Not-Draining
Home-and-Garden,What a Yellow Garage Door Sensor Means &  Fix the Problem,https://www.wikihow.com/Garage-Door-Sensor-Yellow
Home-and-Garden,Fix a Sparking Microwave,https://www.wikihow.com/Microwave-Sparking
Cars-&-Other-Vehicles,Start Riding an ATV,https://www.wikihow.com/Start-Riding-an-ATV
Cars-&-Other-Vehicles,Fix Sun Faded Car Paint,https://www.wikihow.com/Fix-Sun-Faded-Car-Paint
Cars-&-Other-Vehicles,Carry Luggage on Top of Your Car,https://www.wikihow.com/Carry-Luggage-on-Top-of-Your-Car
Cars-&-Other-Vehicles,React if a Power Line Falls on Your Car,https://www.wikihow.com/React-if-a-Power-Line-Falls-on-Your-Car
Cars-&-Other-Vehicles,Tint Car Windows,https://www.wikihow.com/Tint-Car-Windows
Cars-&-Other-Vehicles,Determine Gear Ratio,https://www.wikihow.com/Determine-Gear-Ratio
Cars-&-Other-Vehicles,Clean an Abs Sensor,https://www.wikihow.com/Clean-an-Abs-Sensor
Cars-&-Other-Vehicles,Test a Temperature Sensor with a Multimeter,https://www.wikihow.com/Test-a-Temperature-Sensor-with-a-Multimeter
Cars-&-Other-Vehicles,Diagnose a Flashing Check Engine Light and Shaking Car,https://www.wikihow.com/Check-Engine-Light-Flashing-and-Car-Shaking
Cars-&-Other-Vehicles,Test a Vehicle Speed Sensor with a Multimeter,https://www.wikihow.com/Test-a-Vehicle-Speed-Sensor-with-a-Multimeter
Cars-&-Other-Vehicles,Tell if a Tire Is a Snow Tire,https://www.wikihow.com/Tell-if-a-Tire-Is-a-Snow-Tire
Cars-&-Other-Vehicles,Roll Down the Windows With Your Key Fob,https://www.wikihow.com/Roll-Windows-Down-with-Key-Fob
Cars-&-Other-Vehicles,Diagnose and Fix Low Engine Oil Pressure,https://www.wikihow.com/Fix-Low-Engine-Oil-Pressure
Cars-&-Other-Vehicles,Fill Gas in Canada,https://www.wikihow.com/Fill-Gas-in-Canada
Cars-&-Other-Vehicles,Remove a Dent From a Quarter Panel,https://www.wikihow.com/Pull-a-Dent-Out-of-a-Quarter-Panel
Cars-&-Other-Vehicles,Get on the Delta Standby List,https://www.wikihow.com/Get-on-the-Delta-Standby-List
Cars-&-Other-Vehicles,Paint a Car Roof,https://www.wikihow.com/Paint-a-Car-Roof
Cars-&-Other-Vehicles,Get a Rusted Trailer Hitch Ball Off,https://www.wikihow.com/Get-a-Rusted-Trailer-Hitch-Ball-Off
Cars-&-Other-Vehicles,Replace Suspension Springs,https://www.wikihow.com/Replace-Suspension-Springs
Cars-&-Other-Vehicles,Change a Car Title Address,https://www.wikihow.com/Change-a-Car-Title-Address
Cars-&-Other-Vehicles,Build a Dune Buggy,https://www.wikihow.com/Build-a-Dune-Buggy
Cars-&-Other-Vehicles,Clean Your Driving Record,https://www.wikihow.com/Clean-Your-Driving-Record
Cars-&-Other-Vehicles,Install a Rear View Camera,https://www.wikihow.com/Install-a-Rear-View-Camera
Cars-&-Other-Vehicles,Start a Diesel Truck,https://www.wikihow.com/Start-a-Diesel-Truck
Cars-&-Other-Vehicles,Travel from UK to the US by Boat,https://www.wikihow.com/Travel-from-UK-to-the-US-by-Boat
Cars-&-Other-Vehicles,Park a Truck or Large Vehicle,https://www.wikihow.com/Park-a-Truck-or-Large-Vehicle
Cars-&-Other-Vehicles,Build Trailers,https://www.wikihow.com/Build-Trailers
Cars-&-Other-Vehicles,Tow a Trailer,https://www.wikihow.com/Tow-a-Trailer
Cars-&-Other-Vehicles,Replace a Hydraulic Hose,https://www.wikihow.com/Replace-a-Hydraulic-Hose
Cars-&-Other-Vehicles,Navigate a Roundabout,https://www.wikihow.com/Navigate-a-Roundabout
Cars-&-Other-Vehicles,Hang a Bike on the Wall,https://www.wikihow.com/Hang-a-Bike-on-the-Wall
Cars-&-Other-Vehicles,Know Whether to Call the Police After a Car Accident,https://www.wikihow.com/Know-Whether-to-Call-the-Police-After-a-Car-Accident
Cars-&-Other-Vehicles,Build a Bicycle Cargo Trailer,https://www.wikihow.com/Build-a-Bicycle-Cargo-Trailer
Cars-&-Other-Vehicles,Set and Use a Torque Wrench,https://www.wikihow.com/Use-a-Torque-Wrench
Cars-&-Other-Vehicles,Brake Properly on a Motorcycle,https://www.wikihow.com/Brake-Properly-on-a-Motorcycle
Cars-&-Other-Vehicles,Grease Wheel Bearings on a Trailer,https://www.wikihow.com/Grease-Trailer-Bearings
Cars-&-Other-Vehicles,Countersteer (Motorcycle),https://www.wikihow.com/Countersteer-(Motorcycle)
Cars-&-Other-Vehicles,"Make Right, Left, and U Turns","https://www.wikihow.com/Make-Right,-Left,-and-U-Turns"
Cars-&-Other-Vehicles,Register a Utility Trailer,https://www.wikihow.com/Register-a-Utility-Trailer
Cars-&-Other-Vehicles,Wash Your Bike,https://www.wikihow.com/Wash-Your-Bike
Cars-&-Other-Vehicles,Do Donuts,https://www.wikihow.com/Do-Donuts
Cars-&-Other-Vehicles,Use Jack Stands,https://www.wikihow.com/Use-Jack-Stands
Cars-&-Other-Vehicles,Charge Your RV Battery,https://www.wikihow.com/Charge-Your-RV-Battery
Cars-&-Other-Vehicles,Stop a Bicycle Rim from Wobbling,https://www.wikihow.com/Unwobble-a-Bicycle-Rim
Cars-&-Other-Vehicles,Get a Motorcycle License,https://www.wikihow.com/Get-a-Motorcycle-License
Cars-&-Other-Vehicles,Deal With a Minor Car Accident,https://www.wikihow.com/Deal-With-a-Minor-Car-Accident
Cars-&-Other-Vehicles,Start a Motorcycle,https://www.wikihow.com/Start-a-Motorcycle
Cars-&-Other-Vehicles,Remove Lug Nuts and Tires,https://www.wikihow.com/Remove-Lug-Nuts-and-Tires
Cars-&-Other-Vehicles,Wash a Motorcycle,https://www.wikihow.com/Wash-a-Motorcycle
Cars-&-Other-Vehicles,Start a Used Auto Parts Business,https://www.wikihow.com/Start-a-Used-Auto-Parts-Business
Cars-&-Other-Vehicles,Do a Burnout on a Motorcycle,https://www.wikihow.com/Do-a-Burnout-on-a-Motorcycle
Cars-&-Other-Vehicles,Start a Manual Car on a Hill: Steep Hill Driving Tips,https://www.wikihow.com/Get-Started-on-a-Hill-when-Driving-a-Manual-Transmission-Car
Cars-&-Other-Vehicles,Become a Truck Driver,https://www.wikihow.com/Become-a-Truck-Driver
Cars-&-Other-Vehicles,Clean Battery Terminals,https://www.wikihow.com/Clean-Battery-Terminals
Cars-&-Other-Vehicles,Calibrate a Torque Wrench,https://www.wikihow.com/Calibrate-a-Torque-Wrench
Cars-&-Other-Vehicles,Start a Car Repair Business,https://www.wikihow.com/Start-a-Car-Repair-Business
Cars-&-Other-Vehicles,Install a New Handlebar Grip,https://www.wikihow.com/Install-a-New-Handlebar-Grip
Cars-&-Other-Vehicles,Choose an Auto Transport Company,https://www.wikihow.com/Choose-an-Auto-Transport-Company
Cars-&-Other-Vehicles,Drive a Tractor,https://www.wikihow.com/Drive-a-Tractor
Cars-&-Other-Vehicles,Size a Bike,https://www.wikihow.com/Size-a-Bike
Cars-&-Other-Vehicles,Dispute E-ZPass Violations in NJ and Avoid Toll Violations,https://www.wikihow.com/Dispute-an-E%E2%80%90ZPass-Violation-in-New-Jersey
Cars-&-Other-Vehicles,Make Your Powerwheels Faster,https://www.wikihow.com/Make-Your-Powerwheels-Faster
Cars-&-Other-Vehicles,Build an Airplane,https://www.wikihow.com/Build-an-Airplane
Cars-&-Other-Vehicles,Loosen Lug Nuts,https://www.wikihow.com/Loosen-Lug-Nuts
Cars-&-Other-Vehicles,Open a Car Dealership,https://www.wikihow.com/Open-a-Car-Dealership
Cars-&-Other-Vehicles,Survive a Plane Crash,https://www.wikihow.com/Survive-a-Plane-Crash
