Category,Title,Link
Android,Disable the Emergency Button on Android,https://www.wikihow.com/Remove-the-Emergency-Call-Button-on-Android
Android,Find Hidden Spy Apps on Android: Scanning & Removal,https://www.wikihow.com/Find-Hidden-Spy-Apps-on-Android
Android,Pair and Set Up a Smart Watch with an Android,https://www.wikihow.com/Pair-a-Smartwatch-with-an-Android
Android,Prevent Apps from Auto Starting on Android Smartphones & Tablets,https://www.wikihow.com/Prevent-Apps-from-Auto-Starting-on-Android
Android,Share Apps on Android Bluetooth,https://www.wikihow.com/Share-Apps-on-Android-Bluetooth
Android,Delete the Keyboard History on Android,https://www.wikihow.com/Delete-the-Keyboard-History-on-Android
Android,Install a SIM Card in Your Android & Position It Properly,https://www.wikihow.com/Install-a-SIM-Card-in-an-Android
Android,Root an Android Tablet,https://www.wikihow.com/Root-an-Android-Tablet
Android,Access Android System Files,https://www.wikihow.com/Access-Android-System-Files
Android,Add Music to Your Android Device,https://www.wikihow.com/Add-Music-to-Your-Android-Device
Android,Add a Device to Google Play Store,https://www.wikihow.com/Add-a-Device-to-Google-Play-Store
Android,Install Android Apps on a Windows PC,https://www.wikihow.com/Install-Android-Apps-on-Windows
Android,Use SD Card as Default Storage on Android,https://www.wikihow.com/Use-SD-Card-As-Default-Storage-on-Android
Android,Hide Messages on Android,https://www.wikihow.com/Hide-Messages-on-Android
Android,Disable Google Assistant on Android,https://www.wikihow.com/Disable-Google-Assistant-on-Android
Android,Get Live Wallpaper Videos for Android,https://www.wikihow.com/Get-Live-Wallpaper-on-Android
Android,Force Reboot Your Android,https://www.wikihow.com/Force-Reboot-Your-Android
Android,Scan Barcodes With an Android Phone Using Barcode Scanner,https://www.wikihow.com/Scan-Barcodes-With-an-Android-Phone-Using-Barcode-Scanner
Android,Format an SD Card on Android: A Step-by-Step Guide,https://www.wikihow.com/Format-an-SD-Card-on-Android
Android,Set a Bookmark Shortcut in Your Home Screen on Android,https://www.wikihow.com/Set-a-Bookmark-Shortcut-in-Your-Home-Screen-on-Android
Android,Improve Photo Resolution on Android,https://www.wikihow.com/Improve-Photo-Resolution-on-Android
Android,Add Custom Text Shortcuts to Android,https://www.wikihow.com/Add-Custom-Text-Shortcuts-to-Android
Android,Close Apps on Android,https://www.wikihow.com/Close-Apps-on-Android
Android,Change the Battery on a Samsung Galaxy,https://www.wikihow.com/Change-the-Battery-on-a-Samsung-Galaxy
Android,Lock the Bootloader on Android,https://www.wikihow.com/Lock-the-Bootloader-on-Android
Android,Connect Android Auto to Your Car via a USB Cable or Bluetooth,https://www.wikihow.com/Connect-Android-Auto
Using-PDF-Files,Reduce PDF File Size,https://www.wikihow.com/Reduce-PDF-File-Size
Using-PDF-Files,Compress a PDF File: 4 Easy Tricks on PC & Mac,https://www.wikihow.com/Compress-a-PDF-File
Using-PDF-Files,Edit a PDF on an iPad,https://www.wikihow.com/Edit-a-PDF-on-an-iPad
Using-PDF-Files,Cite a PDF,https://www.wikihow.com/Cite-a-PDF
Using-PDF-Files,Copy a Table from a PDF to Excel,https://www.wikihow.com/Copy-a-Table-from-a-PDF-to-Excel
Using-PDF-Files,Scan Multiple Pages Into One PDF File,https://www.wikihow.com/Scan-Multiple-Pages-Into-One-PDF-File
Using-PDF-Files,Convert a DWG File to a PDF,https://www.wikihow.com/Convert-an-AutoCAD-File-to-PDF
Using-PDF-Files,Unlock a Secure PDF File,https://www.wikihow.com/Unlock-a-Secure-PDF-File
Using-PDF-Files,Download PDFs,https://www.wikihow.com/Download-PDFs
Using-PDF-Files,Print PDF Files,https://www.wikihow.com/Print-PDF-Files
Using-PDF-Files,View a PDF Document in Full Screen View,https://www.wikihow.com/View-a-PDF-Document-in-Full-Screen-View
Using-PDF-Files,Copy an Image from a PDF,https://www.wikihow.com/Copy-Pictures-from-a-PDF
Using-PDF-Files,Create a Copy of a Page in a PDF Document,https://www.wikihow.com/Create-a-Copy-of-a-Page-in-a-PDF-Document
Using-PDF-Files,Load Adobe PDF Files Faster,https://www.wikihow.com/Load-Adobe-PDF-Files-Faster
Using-PDF-Files,Create a Fillable PDF,https://www.wikihow.com/Create-a-Fillable-PDF
Using-PDF-Files,Copy and Paste an Image from PDF to Word,https://www.wikihow.com/Copy-an-Image-from-PDF-to-Word-on-PC-or-Mac
Using-PDF-Files,Add Page Numbers to a PDF,https://www.wikihow.com/Add-Page-Numbers-to-a-PDF
Using-PDF-Files,"Open, Use, & Make VTT Files: Your Questions Answered",https://www.wikihow.com/Vtt-File
Using-PDF-Files,"Make a PDF into a Link on Google Drive, Dropbox, & More",https://www.wikihow.com/Make-a-PDF-a-Link
Using-PDF-Files,Convert Images and PDF Files to Editable Text,https://www.wikihow.com/Convert-Images-and-PDF-Files-to-Editable-Text
Using-PDF-Files,Password Protect a PDF,https://www.wikihow.com/Password-Protect-a-PDF
Using-PDF-Files,See a Password Protected PDF Using Gmail,https://www.wikihow.com/See-a-Password-Protected-PDF-Using-Gmail
Using-PDF-Files,Print a PDF Email Attachment,https://www.wikihow.com/Print-a-PDF-Email-Attachment
Using-PDF-Files,Work With Toolbars in Adobe Acrobat,https://www.wikihow.com/Work-With-Toolbars-in-Adobe-Acrobat
Using-PDF-Files,Translate a PDF,https://www.wikihow.com/Translate-a-PDF
Using-PDF-Files,Customize a PDF's Default View in Acrobat Pro,https://www.wikihow.com/Set-the-Opening-View-of-a-PDF-in-Acrobat-Professional
Better-Writing,Write Faster,https://www.wikihow.com/Write-Faster
Better-Writing,Express Anger in Writing,https://www.wikihow.com/Express-Anger-in-Writing
Better-Writing,Improve Your Writing Skills,https://www.wikihow.com/Improve-Your-Writing-Skills
Better-Writing,Be a Good Writer,https://www.wikihow.com/Be-a-Good-Writer
Better-Writing,Avoid Colloquial (Informal) Writing,https://www.wikihow.com/Avoid-Colloquial-(Informal)-Writing
Calculating-Volume-and-Area,Calculate the Area of a Trapezoid,https://www.wikihow.com/Calculate-the-Area-of-a-Trapezoid
Calculating-Volume-and-Area,Calculate Square Meters,https://www.wikihow.com/Calculate-Square-Meters
Calculating-Volume-and-Area,Calculate the Area of a Circle,https://www.wikihow.com/Calculate-the-Area-of-a-Circle
Calculating-Volume-and-Area,Calculate the Area of a Triangle,https://www.wikihow.com/Calculate-the-Area-of-a-Triangle
Calculating-Volume-and-Area,Find the Area of a Rectangle: Length x Width & Pythagorean Theorem,https://www.wikihow.com/Calculate-the-Area-of-a-Rectangle
Calculating-Volume-and-Area,Calculate the Area of a Hexagon,https://www.wikihow.com/Calculate-the-Area-of-a-Hexagon
Calculating-Volume-and-Area,Calculate the Area of a Rhombus,https://www.wikihow.com/Calculate-the-Area-of-a-Rhombus
Calculating-Volume-and-Area,Easily Calculate the Surface Area of a Rectangular Prism,https://www.wikihow.com/Find-the-Surface-Area-of-a-Rectangular-Prism
Calculating-Volume-and-Area,Calculate the Area of a Polygon,https://www.wikihow.com/Calculate-the-Area-of-a-Polygon
Calculating-Volume-and-Area,Find the Area of a Regular Pentagon,https://www.wikihow.com/Find-the-Area-of-a-Regular-Pentagon
Calculating-Volume-and-Area,Calculate the Area of an Ellipse,https://www.wikihow.com/Calculate-the-Area-of-an-Ellipse
Calculating-Volume-and-Area,Calculate Linear Feet,https://www.wikihow.com/Calculate-Linear-Feet
Calculating-Volume-and-Area,Find the Circumference of a Circle Using Its Area,https://www.wikihow.com/Find-the-Circumference-of-a-Circle-Using-Its-Area
Calculating-Volume-and-Area,Find the Area of a Circle Using Its Circumference,https://www.wikihow.com/Find-the-Area-of-a-Circle-Using-Its-Circumference
Calculating-Volume-and-Area,Determine Square Inches,https://www.wikihow.com/Determine-Square-Inches
Calculating-Volume-and-Area,Find the Surface Area of a Box,https://www.wikihow.com/Find-the-Surface-Area-of-a-Box
Calculating-Volume-and-Area,Calculate the Area of Any Quadrilateral: A Step-by-Step Guide,https://www.wikihow.com/Find-the-Area-of-a-Quadrilateral
Calculating-Volume-and-Area,Find Surface Area,https://www.wikihow.com/Find-Surface-Area
Calculating-Volume-and-Area,Find the Area of a Semicircle: Formula & Calculation Tips,https://www.wikihow.com/Find-the-Area-of-a-Semicircle
Calculating-Volume-and-Area,Find the Area of a Shape,https://www.wikihow.com/Find-the-Area-of-a-Shape
Calculating-Volume-and-Area,Find the Area of an Isosceles Triangle,https://www.wikihow.com/Find-the-Area-of-an-Isosceles-Triangle
Calculating-Volume-and-Area,Calculate the Surface Area of a Cube (By Length or Volume),https://www.wikihow.com/Find-the-Surface-Area-of-a-Cube
Calculating-Volume-and-Area,Find the Area of a Rectangle Using the Diagonal,https://www.wikihow.com/Find-the-Area-of-a-Rectangle-Using-the-Diagonal
Calculating-Volume-and-Area,Find the Area of Regular Polygons,https://www.wikihow.com/Find-the-Area-of-Regular-Polygons
Calculating-Volume-and-Area,Find the Surface Area of Cylinders,https://www.wikihow.com/Find-the-Surface-Area-of-Cylinders
Calculating-Volume-and-Area,Calculate the Case Cube of a Box,https://www.wikihow.com/Calculate-the-Case-Cube-of-a-Box
Calculating-Volume-and-Area,Find the Volume of a Cube from Its Surface Area,https://www.wikihow.com/Find-the-Volume-of-a-Cube-from-Its-Surface-Area
Calculating-Volume-and-Area,Calculate the Area of a Sector,https://www.wikihow.com/Calculate-the-Area-of-a-Sector
Calculating-Volume-and-Area,Find the Area of a Square,https://www.wikihow.com/Find-the-Area-of-a-Square
Calculating-Volume-and-Area,Find the Area of a Square Using the Length of its Diagonal,https://www.wikihow.com/Find-the-Area-of-a-Square-Using-the-Length-of-its-Diagonal
Calculating-Volume-and-Area,Find Density,https://www.wikihow.com/Find-Density
Calculating-Volume-and-Area,Calculate the Area of 2D and 3D Shapes,https://www.wikihow.com/Calculate-Area-of-an-Object
Calculating-Volume-and-Area,Calculate the Area of a Parallelogram,https://www.wikihow.com/Calculate-the-Area-of-a-Parallelogram
Calculating-Volume-and-Area,Find the Area of a Kite,https://www.wikihow.com/Find-the-Area-of-a-Kite
Calculating-Volume-and-Area,Find the Surface Area of a Sphere,https://www.wikihow.com/Find-the-Surface-Area-of-a-Sphere
Calculating-Volume-and-Area,Calculate the Center of Gravity of a Triangle,https://www.wikihow.com/Calculate-the-Center-of-Gravity-of-a-Triangle
Calculating-Volume-and-Area,Find the Area and Perimeter of a Rectangle,https://www.wikihow.com/Find-the-Area-and-Perimeter-of-a-Rectangle
Calculating-Volume-and-Area,Find the Circumference and Area of a Circle,https://www.wikihow.com/Find-the-Circumference-and-Area-of-a-Circle
Calculating-Volume-and-Area,Find the Area of a Parallelogram,https://www.wikihow.com/Find-the-Area-of-a-Parallelogram
Calculating-Volume-and-Area,Find Surface Area of a Triangular Prism,https://www.wikihow.com/Find-Surface-Area-of-a-Triangular-Prism
Calculating-Volume-and-Area,Find the Surface Area of Cones,https://www.wikihow.com/Find-the-Surface-Area-of-Cones
Calculating-Volume-and-Area,Find Area,https://www.wikihow.com/Find-Area
Married-Life,Be a Good Husband,https://www.wikihow.com/Be-a-Good-Husband
Married-Life,Change Your Name After Marriage,https://www.wikihow.com/Change-Your-Name-After-Marriage
Married-Life,Dress for Your Husband in Bed,https://www.wikihow.com/Dress-for-Your-Husband-in-Bed
Married-Life,Get Your Husband to Notice You Sexually,https://www.wikihow.com/Get-Your-Husband-to-Notice-You-Sexually
Married-Life,Have Good Sex in Marriage,https://www.wikihow.com/Have-Good-Sex-in-Marriage
Married-Life,Make Your Husband Feel Loved,https://www.wikihow.com/Make-Your-Husband-Feel-Loved
Married-Life,14 Signs Your Wife Is Not Attracted To You (&  Move Forward),https://www.wikihow.com/Signs-My-Wife-Is-Not-Attracted-to-Me
Married-Life,Make Your Husband Happy,https://www.wikihow.com/Make-Your-Husband-Happy
Married-Life,Talk in an Arranged Marriage Meeting,https://www.wikihow.com/Talk-in-an-Arranged-Marriage-Meeting
Married-Life,Flirt with Your Husband,https://www.wikihow.com/Flirt-with-Husband
Married-Life,Fix a Marriage Without Counseling,https://www.wikihow.com/Fix-a-Marriage-Without-Counseling
Married-Life,Be a Good Housewife,https://www.wikihow.com/Be-a-Good-Housewife
Married-Life,Get to Know a Girl Before an Arranged Marriage,https://www.wikihow.com/Get-to-Know-a-Girl-Before-an-Arranged-Marriage
Married-Life,Treat Your Husband: Meet His Emotional & Romantic Needs,https://www.wikihow.com/Care-for-Your-Husband
Married-Life,Convince Your Parents of Your Intercaste Love,https://www.wikihow.com/Convince-Your-Parents-of-Your-Intercaste-Love
Married-Life,Make Your Wife Happy,https://www.wikihow.com/Make-Your-Wife-Happy
Married-Life,Cope With a Bisexual Husband,https://www.wikihow.com/Cope-With-a-Bisexual-Husband
Married-Life,Control Your Man,https://www.wikihow.com/Control-Your-Man
Married-Life,Live a Long and Happy Married Life,https://www.wikihow.com/Live-a-Happy-Married-Life
Married-Life,be a Great Stay-at-Home Husband,https://www.wikihow.com/Be-a-Good-House-Husband
Married-Life,What Is a Trophy Husband? (Plus  Become One),https://www.wikihow.com/Trophy-Husband
Married-Life,Be a Nicer Person to Your Spouse,https://www.wikihow.com/Be-a-Nicer-Person-to-Your-Spouse
Married-Life,Live Life After Marriage,https://www.wikihow.com/Live-Life-After-Marriage
Married-Life,Deal with an Abusive Wife,https://www.wikihow.com/Deal-with-an-Abusive-Wife
Married-Life,Have a Great Marriage,https://www.wikihow.com/Have-a-Great-Marriage
Married-Life,Be a Great Husband,https://www.wikihow.com/Be-a-Great-Husband
Married-Life,Be a Good Husband and Father,https://www.wikihow.com/Be-a-Good-Husband-and-Father
Married-Life,Describe a Good Marriage,https://www.wikihow.com/Describe-a-Good-Marriage
Married-Life,Be a Perfect Couple,https://www.wikihow.com/Be-a-Perfect-Couple
Married-Life,Change the Name on a Driver's License Due to Marriage,https://www.wikihow.com/Change-the-Name-on-a-Driver%27s-License-Due-to-Marriage
Married-Life,"Loneliness in Marriage: Symptoms, Causes &  Cope",https://www.wikihow.com/Lonely-in-Marriage
Married-Life,Expert Wedding Planners Charge,https://www.wikihow.com/Expert-Wedding-Planners-Charge
Death-Funerals-and-Bereavement,Fake Your Death & Disappear Without a Trace,https://www.wikihow.com/Fake-Your-Own-Death
Death-Funerals-and-Bereavement,Find Out when Someone Died,https://www.wikihow.com/Find-Out-when-Someone-Died
Death-Funerals-and-Bereavement,Write a Touching Obituary,https://www.wikihow.com/Write-an-Obituary
Death-Funerals-and-Bereavement,Get a Message from a Deceased Loved One (and 6 Signs They're Still With You),https://www.wikihow.com/Get-a-Message-from-a-Deceased-Loved-One
Death-Funerals-and-Bereavement,Find a Person's Grave,https://www.wikihow.com/Find-a-Person%27s-Grave
Death-Funerals-and-Bereavement,Tell if Someone Is Dead,https://www.wikihow.com/Tell-if-Someone-Is-Dead
Death-Funerals-and-Bereavement,"Clean a Gravestone: Gentle Ways to Remove Moss, Lichen, and More",https://www.wikihow.com/Clean-a-Gravestone
Death-Funerals-and-Bereavement,Address a Widow,https://www.wikihow.com/Address-a-Widow
Death-Funerals-and-Bereavement,Overcome the Fear of Death,https://www.wikihow.com/Overcome-the-Fear-of-Death
Death-Funerals-and-Bereavement,Amend a Death Certificate,https://www.wikihow.com/Amend-a-Death-Certificate
Death-Funerals-and-Bereavement,Handle Finding a Dead Body,https://www.wikihow.com/Handle-Finding-a-Dead-Body
Death-Funerals-and-Bereavement,Overcome the Fear of Losing a Loved One,https://www.wikihow.com/Overcome-the-Fear-of-Losing-a-Loved-One
Death-Funerals-and-Bereavement,Move a Gravesite,https://www.wikihow.com/Move-a-Gravesite
Death-Funerals-and-Bereavement,Stop Obsessing About Death,https://www.wikihow.com/Stop-Obsessing-About-Death
Death-Funerals-and-Bereavement,Comfort Someone Who Lost a Pet: 15 Things to Say,https://www.wikihow.com/What-to-Say-when-Someone-Loses-a-Pet
Death-Funerals-and-Bereavement,Find Death Notices for Free,https://www.wikihow.com/Find-Death-Notices-for-Free
Death-Funerals-and-Bereavement,Declare the Death of a Missing Person,https://www.wikihow.com/Declare-the-Death-of-a-Missing-Person
Business-Writing,Write a Receipt,https://www.wikihow.com/Write-a-Receipt
Business-Writing,Expert Advice on  Write a Professional Email,https://www.wikihow.com/Write-a-Professional-Email
Business-Writing,Write an Analysis,https://www.wikihow.com/Write-an-Analysis
Business-Writing,Write a Business Plan,https://www.wikihow.com/Write-a-Business-Plan
Business-Writing,Write a Business Profile,https://www.wikihow.com/Write-a-Business-Profile
Business-Writing,Write a Business Plan for a Small Business,https://www.wikihow.com/Write-a-Business-Plan-for-a-Small-Business
Business-Writing,Write Business Emails,https://www.wikihow.com/Write-Business-Emails
Business-Writing,Write Brochures,https://www.wikihow.com/Write-Brochures
Business-Writing,Compose a Business Email to Someone You Do Not Know,https://www.wikihow.com/Compose-a-Business-Email-to-Someone-You-Do-Not-Know
Business-Writing,Write a Technical Report,https://www.wikihow.com/Write-a-Technical-Report
Business-Writing,Write a Management Plan,https://www.wikihow.com/Write-a-Management-Plan
Business-Writing,Address a Woman in a Business Letter,https://www.wikihow.com/Address-a-Woman-in-a-Business-Letter
Business-Writing,Write a Business Letter to Customers,https://www.wikihow.com/Write-a-Business-Letter-to-Customers
Business-Writing,Write a Standard Operating Procedure,https://www.wikihow.com/Write-a-Standard-Operating-Procedure
Business-Writing,Write an Executive Summary,https://www.wikihow.com/Write-an-Executive-Summary
Business-Writing,Write a Prospectus,https://www.wikihow.com/Write-a-Prospectus
Business-Writing,Write a Work Plan,https://www.wikihow.com/Write-a-Work-Plan
Business-Writing,Write an Industry Analysis Report,https://www.wikihow.com/Write-an-Industry-Analysis-Report
Business-Writing,Write a Financial Report,https://www.wikihow.com/Write-a-Financial-Report
Business-Writing,Write a Concept Paper,https://www.wikihow.com/Write-a-Concept-Paper
Business-Writing,Write a Business Proposal,https://www.wikihow.com/Write-a-Business-Proposal
Business-Writing,Write a Manual,https://www.wikihow.com/Write-a-Manual
Business-Writing,Write a Problem Statement,https://www.wikihow.com/Write-a-Problem-Statement
Business-Writing,Write a Proposal to Management,https://www.wikihow.com/Write-a-Proposal-to-Management
Business-Writing,Write a Use Case,https://www.wikihow.com/Write-a-Use-Case
Business-Writing,Write a Business Plan for a Startup,https://www.wikihow.com/Write-a-Business-Plan-for-a-Startup
Business-Writing,Address a Business Envelope Effectively,https://www.wikihow.com/Address-a-Business-Envelope-Effectively
Business-Writing,Write a Legal Disclaimer for Your Business,https://www.wikihow.com/Write-a-Legal-Disclaimer-for-Your-Business
Business-Writing,Write a Safety Manual,https://www.wikihow.com/Write-a-Safety-Manual
Business-Writing,Write a Business Memo,https://www.wikihow.com/Write-a-Business-Memo
Business-Writing,Write a Business Report,https://www.wikihow.com/Write-a-Business-Report
Business-Writing,Write a Communications Strategy,https://www.wikihow.com/Write-a-Communications-Strategy
Business-Writing,Write a Business Process Document,https://www.wikihow.com/Write-a-Business-Process-Document
Business-Writing,Write a Good Economics Essay,https://www.wikihow.com/Write-a-Good-Economics-Essay
Business-Writing,Write a Management Case Study,https://www.wikihow.com/Write-a-Management-Case-Study
Business-Writing,Create a Communication Plan,https://www.wikihow.com/Create-a-Communication-Plan
Checks-and-Checkbooks,Write a Check,https://www.wikihow.com/Write-a-Check
Checks-and-Checkbooks,Tell a Check Is Fake & What to Do If You’ve Been Scammed,https://www.wikihow.com/Spot-a-Fake-Check
Checks-and-Checkbooks,Calculate the Check Digit of a Routing Number from an Illegible Check,https://www.wikihow.com/Calculate-the-Check-Digit-of-a-Routing-Number-from-an-Illegible-Check
Checks-and-Checkbooks,Balance a Checkbook,https://www.wikihow.com/Balance-a-Checkbook
Checks-and-Checkbooks,Cash a Cheque (Check) In Person or Online,https://www.wikihow.com/Cash-a-Cheque
Checks-and-Checkbooks,Cash a Check Made Out to Two People,https://www.wikihow.com/Cash-a-Check-Made-Out-to-Two-People
Checks-and-Checkbooks,Fix Mistakes Made when Writing Checks,https://www.wikihow.com/Fix-Mistakes-Made-when-Writing-Checks
Checks-and-Checkbooks,Cash a Check,https://www.wikihow.com/Cash-a-Check
Checks-and-Checkbooks,Locate a Check Routing Number,https://www.wikihow.com/Locate-a-Check-Routing-Number
Checks-and-Checkbooks,Create a Simple Checkbook Register With Microsoft Excel,https://www.wikihow.com/Create-a-Simple-Checkbook-Register-With-Microsoft-Excel
Checks-and-Checkbooks,Deposit Checks,https://www.wikihow.com/Deposit-Checks
Checks-and-Checkbooks,Write a Check With Cents,https://www.wikihow.com/Write-a-Check-With-Cents
Checks-and-Checkbooks,Fill Out a Cashier's Check,https://www.wikihow.com/Fill-Out-a-Cashier%27s-Check
Checks-and-Checkbooks,Fill Out a Checking Deposit Slip,https://www.wikihow.com/Fill-Out-a-Checking-Deposit-Slip
Checks-and-Checkbooks,Sign over a Check,https://www.wikihow.com/Sign-over-a-Check
Checks-and-Checkbooks,Print Checks,https://www.wikihow.com/Print-Checks
Checks-and-Checkbooks,Send Checks,https://www.wikihow.com/Send-Checks
Checks-and-Checkbooks,Deposit a Check Online,https://www.wikihow.com/Deposit-a-Check-Online
Checks-and-Checkbooks,Write a Check to Two People,https://www.wikihow.com/Write-a-Check-to-Two-People
Checks-and-Checkbooks,Order Checks,https://www.wikihow.com/Order-Checks
Checks-and-Checkbooks,Fill Out a Checkbook,https://www.wikihow.com/Fill-Out-a-Checkbook
Checks-and-Checkbooks,Verify Funds Before Cashing a Check,https://www.wikihow.com/Verify-Funds-Before-Cashing-a-Check
Checks-and-Checkbooks,Read a Check,https://www.wikihow.com/Read-a-Check
Checks-and-Checkbooks,Open a Checking Account for a Decedent's Estate,https://www.wikihow.com/Open-a-Checking-Account-for-a-Decedent%27s-Estate
Checks-and-Checkbooks,Write a Check on a US Bank to a Canadian Payee,https://www.wikihow.com/Write-a-Check-on-a-US-Bank-to-a-Canadian-Payee
Checks-and-Checkbooks,Deposit Checks With the Bank of America iPhone App,https://www.wikihow.com/Deposit-Checks-With-the-Bank-of-America-iPhone-App
Checks-and-Checkbooks,Pay by Check at a Store,https://www.wikihow.com/Pay-by-Check-at-a-Store
Checks-and-Checkbooks,Order Checks for the First Time,https://www.wikihow.com/Order-Checks-for-the-First-Time
Checks-and-Checkbooks,Get a Checking Account if You're Listed in Chexsystems,https://www.wikihow.com/Get-a-Checking-Account-if-You%27re-Listed-in-Chexsystems
Cakes,"Bake a Simple, Plain Cake from Scratch",https://www.wikihow.com/Make-a-Plain-Cake
Cakes,Cut a Round Cake,https://www.wikihow.com/Cut-a-Round-Cake
Cakes,Make a Cake Pop Holder,https://www.wikihow.com/Make-a-Cake-Pop-Holder
Cakes,Bake a Two Layer Cake: A Step-by-Step Guide,https://www.wikihow.com/Bake-a-Two-Layer-Cake
Cakes,Make Cake in a Mug,https://www.wikihow.com/Make-Cake-in-a-Mug
Cakes,Bake Cakes in Springform Pans,https://www.wikihow.com/Bake-Cakes-in-Springform-Pans
Cakes,Store a Christmas Cake,https://www.wikihow.com/Store-a-Christmas-Cake
Cakes,Replace All Purpose Flour with Cake Flour,https://www.wikihow.com/Replace-All-Purpose-Flour-with-Cake-Flour
Cakes,Bake Nigerian Cake,https://www.wikihow.com/Bake-Nigerian-Cake
Cakes,Make Cake Without an Oven,https://www.wikihow.com/Make-Cake-Without-an-Oven
Cakes,Store Cake Pops,https://www.wikihow.com/Store-Cake-Pops
Cakes,Make a Cake Using a Pressure Cooker,https://www.wikihow.com/Make-a-Cake-Using-a-Pressure-Cooker
Cakes,Ice a Cake,https://www.wikihow.com/Ice-a-Cake
Cakes,Make Cake Pops Without Sticks,https://www.wikihow.com/Make-Cake-Pops-Without-Sticks
Egg-Basics,Boil an Egg in an Electric Kettle,https://www.wikihow.com/Boil-an-Egg-in-an-Electric-Kettle
Egg-Basics,Make a Soft Boiled Egg,https://www.wikihow.com/Make-a-Soft-Boiled-Egg
Egg-Basics,Poach an Egg,https://www.wikihow.com/Poach-an-Egg
Egg-Basics,Cook Egg Whites,https://www.wikihow.com/Cook-Egg-Whites
Egg-Basics,Make Sunny Side up Eggs,https://www.wikihow.com/Make-Sunny-Side-up-Eggs
Egg-Basics,Tell When an Egg Is Boiled,https://www.wikihow.com/Tell-When-an-Egg-Is-Boiled
Egg-Basics,Pasteurize Eggs,https://www.wikihow.com/Pasteurize-Eggs
Egg-Basics,Fry an Egg,https://www.wikihow.com/Fry-an-Egg
Egg-Basics,Cook Eggs in the Microwave,https://www.wikihow.com/Microwave-an-Egg
Egg-Basics,Boil an Egg So That It Peels Easily,https://www.wikihow.com/Boil-an-Egg-So-That-It-Peels-Easily
Egg-Basics,Beat Egg Whites,https://www.wikihow.com/Beat-Egg-Whites
Egg-Basics,Store Egg Yolks,https://www.wikihow.com/Store-Egg-Yolks
Egg-Basics,Cook Eggs,https://www.wikihow.com/Cook-Eggs
Egg-Basics,Boil Eggs in a Rice Cooker,https://www.wikihow.com/Boil-Eggs-in-a-Rice-Cooker
Egg-Basics,Eat Soft Boiled Eggs,https://www.wikihow.com/Eat-Soft-Boiled-Eggs
Egg-Basics,Steam an Egg,https://www.wikihow.com/Steam-an-Egg
Reproductive-Health,Control Sexual Urges,https://www.wikihow.com/Control-Sexual-Urges
Reproductive-Health,Stop Thinking About Sex,https://www.wikihow.com/Stop-Thinking-About-Sex
Reproductive-Health,Stop Wet Dreams,https://www.wikihow.com/Stop-Wet-Dreams
Reproductive-Health,Overcome a Fear of Sex,https://www.wikihow.com/Overcome-a-Fear-of-Sex
Reproductive-Health,Use K-Y Jelly Personal Lubricant & Yours + Mine Couples Lube,https://www.wikihow.com/Apply-K%E2%80%90Y-Jelly
Reproductive-Health,Live With a Nymphomaniac,https://www.wikihow.com/Live-With-a-Nymphomaniac
Reproductive-Health,Be Less Perverted,https://www.wikihow.com/Be-Less-Perverted
Reproductive-Health,Talk About the Birds and the Bees,https://www.wikihow.com/Talk-About-the-Birds-and-the-Bees
Reproductive-Health,Stay a Virgin,https://www.wikihow.com/Stay-a-Virgin
Reproductive-Health,Practice Abstinence,https://www.wikihow.com/Practice-Abstinence
